1日目,ならず者ディーター,村人,ジムゾン>>234「ディータ発言しているのにものすごいステルス性能発揮」て俺その時点全然発言してねーぞ、と。議題回答とカタリナに質問一つ飛ばしただけで寝てるから、ステルスも何も寡黙寡黙！ま、夜明け直後だっつーのが一番の理由だがな！あと気になったのはヨアの発言量だな！喉30ぐらいほしーよなと勝手に決め付ける（笑）
1日目,司書クララ,村人,こんばんは。カタリナさま＞霊先、占先というよりは、早さを優先したということですね。想定していた意見もあったけど切捨て、と。昨夜までの動きと合わせて申告に違和感無いですね。ありがとうございます。カタリナさまは旅青考察を中心に、深さが増していますね。考察内容自体も思考過程を追えます。対して神父さまの考察にはこなし感をやや感じたのですが、>>265「必死こいて～ガックリ」を見ると、灰考察に対して
1日目,司書クララ,村人,見返りを求める意識が感じられます。CO後の集計などを含め、信用を得たいという意識が強い気がしますね。神真有りえないという程では無いのですが、現時点での印象では羊＞神です。奇数進行であれば偽占が狂であってもPP防止に吊るべきで、占い内訳が狂狼どちらかは特に気にしなくても良さそうですね。確霊ならば遅からぬ内に占機能は破壊されるでしょうから、ローラーも考えなくて良さそうです。灰を見ていきますと、
1日目,司書クララ,村人,シモンさまは村側意識を持って盤面の進行を考えつつ発言されているように見受けられますね。ここの偽装は難しいと思うので、信頼できそうです。動向は見ますが。逆に少し気になったのがパメラさま。>>248ですが、結局はシモンさまの意見とは全く異なった結論に至っている気がするので、「思想が近い」に若干の疑問が。灰考察ももう少し思考の過程をお見せ頂けるとありがたいです。残りの方が発言少なくてまだなんとも
1日目,司書クララ,村人,言えない感じですが…★ヨアヒムさま>>238の「僕的には～ニコさん」の部分ですが、「気になる突っ込み方」はどういうニュアンスの「気になる」なのでしょうか？そして、占わなくていいに至る理由も教えて頂きたいです。占い先には斑が出ても確白になっても困らない人を選びたいです。そういう意味で寡黙占いには消極的です。そろそろ喉が痛くなってきましたので少し黙って眺めていますね。【のど飴】皆さんもどうぞ。
1日目,少年ペーター,村人,う～ん。初日は情報少なすぎて苦手なんだ～。まず占い士さんだけど僕は、いろんな人が突っ込んでいるけどカタリナさんの>>174 は布石に見えるかな。神父様のＣＯが出揃うまでは・・・ってほうがしっくりくるけどまだ何ともいえないよね。今のところってことで言うなら神＞羊かな僕は。
1日目,少年ペーター,村人,とりあえずヨアヒムにーちゃん>>205 とヤコブさん>>207のニコラスさんのＣＯ突っ込みは、状況が見えていない村人っぽいかな？僕もぱっと見これで3ＣＯか・・・とおもったもの。もちろんこれも確証はないよ～。
1日目,少年ペーター,村人,シモンさん>>224 とヤコブさん>>240 村長さんのＣＯが出てないからって気になっているのはよくわかります。あとは村長さんだけだな～。陣容はどうきまるのかな？ってやっぱり気になっちゃいますものね。
1日目,ならず者ディーター,村人,現状のざっと灰雑感シモン＞初日はその人の人となりを知るためという考えから>>224から続く己の思考開示は言動が一致している。喋ってくれる人はこのままおいておいたら思考が追いやすい。てことで放置んぐ。クララ＞よくあの少ない流れでそこまで読み取れることができるなと脱帽。スキル高いと（勝手に）認定。てきぱき自身の考えを述べて気になったところは質問していくスタンスが好印象だな。放置んぐ。
1日目,ならず者ディーター,村人,ニコラス＞能力者に対してがんがんいこうぜな姿勢。きっと灰に対しても同じような姿勢でSっ気を出すと思うので、今日は放置んぐ。ヨアヒム＞ニコラスと反対に柔和な態度で周りをめろめろにしてやろうってタイプ。★青>>235「（リデルは）真っぽい姿勢」てどんなところだ？放置んぐ。パメラ＞終わった事だが、リデルにCOについて質問>>248してるが、俺としてはこの人数の場合占ロケットCOがあるて方が想定外
1日目,ならず者ディーター,村人,だったCO。★娘>>250「ニコラスリーザは要注意」てどんな風に注意なんだ？リーザ＞村の総意って便利な言葉だよな。妙>>176「さっさと騙りをださせることで、相談させる隙を少なくできる」としてFO希望し、妙>>199でカタリナのロケットCOに対して若干不満な様子を受けるんだが、それはカタリナが希望を述べずに答えたことによる不満（リデルは自身の希望を述べている）なんだろーかとか漠然と考え中。
1日目,ならず者ディーター,村人,ヤコブとペタと村長はもっと発言見てからだな。ひとまず希望としては●リズ○パメラなとこだな。今日放置んぐのカテゴリーと、発言待ちカテゴリーを外して残り二人をあみだ…（げふん）パッションと言う名の情熱で選んだ。今後の発言によって変更大だな。クララのど飴さんきゅな！んまい！＠10
1日目,少年ペーター,村人,よく喋っているなかではシモンさんとクララさんは独自の考えをもっていながら、それを前面にだしてわかってもらおうとしている点が好感もてるかな。シモンさんの初日は人を見るって考えは同感だし。クララさんの>>246 ニコラスさんの考察も思考読みのようでおもしろいね。
1日目,少年ペーター,村人,情報を常に落としてくれそうなのがクララさんとディーターさんとニコラスさんかな？この調子で細かく発言拾ってくれれば村側にとって有利になると思う。253>> 村長さんの青娘が怪しいは、なにが怪しいんだかさっぱりわからないんでほぼ情報ないに等しいです。たしかに孤独感は感じられるけど・・・どうなんだろう。
1日目,少年ペーター,村人,僕は今日の●はよくわからないから占っときたいか。この人が狼なら怖いなって人から占いたいと思います。よくわからない候補はリーザちゃん、パメラさん。村長さんはよく判らない候補じゃなくてまったくわからに分類しておきます。次にこの人が狼だったら怖いな候補はクララさんとディーターさん。
1日目,少年ペーター,村人,この二人を占うのは狼狙いもあるけど僕自信がノイズなしに意見を聞いてみたいって言う白確狙いもあります。まだ希望はきまってませんので後ほど。
1日目,村長ヴァルター,狂人,僕の今日の●候補はクララさんかディーターさんです。理由はこの二人のどちらかが狼だったらかなり怖いからです。
1日目,旅人ニコラス,人狼,今帰ったこれから議事録を読んでくる。
1日目,神父ジムゾン,人狼,大事な事だから二回……くすん。のど飴いただきますね。ディちゃんがステルスでもなんでもない事確認。〇から外します。ペーター君は後程精査。パメラですが、突っ込まれている『ヨアヒム君と意見が同じ』は未発言だけど同じと言う事ではないでしょうか。具体的な引用は欲しい所です。村長の華麗な追従に吹きつつまた後程。
1日目,少女リーザ,狩人,戻りました。今日は村中に落とし穴を作ってまわっていました。狼の一匹や二匹落ちているやもですね。■３．さて、占いですが●村長でお願いします。　本日の村長の言動ですが、狼であるようには感じませんが後半言動から白決め打って放置できるとも思えません。
1日目,少女リーザ,狩人,>>285●理由が非常に薄いことからも非常に不安です。本日占ってしまって白確定するならよし、パンダならまたそれもよし。今日は●村長が最善手かと思いました。さて、議事録読み直してきます。（私も寝る前ちらっと「あれ、３ＣＯかしまったなぁ、まぁいいや、寝よう」と思っていたら>>201これはＣＯではなかったのね。勘違いは往々にしてありえるね）
1日目,農夫ヤコブ,村人,戻っただぁ。今日は雨に降られて仕事になんながったが、モリ爺のところでつかまっちまったべ。んで、【尼さん霊確定確認だべ】よろすくなぁ。シモさんの>>225～は目にとまるだぁ。方針を言ってくれるとおらとしても分かりやすくて助かるだ。無駄な誤解が生まれねぇよおに、予め言っとく姿勢は理解できるなぁ。んだけんども、その話でいくと序盤の占吊希望先あげは黒くなくても希望出せるっちゃぁ出せるべぇ。ややぁ、まぁ
1日目,農夫ヤコブ,村人,そうは言っても黒くみてるわけではないがらな。おらは他人を見るとき、"ぷらす"にも"まいなす"にも一度捉えるかんなぁ。そうだなぁ、おらは狼探すとき、分かりやすいところで言えば、聞いた本人が答えを還元してるかどうかを見たいと思ってるだぁ。そんでな、旅の非占非霊の分かりづらさ>>201に、気になったおらとしてもな、青年の勘違い>>205する気持ちもわからねーでもないんだ。それを非狼要素と捉える人も
1日目,農夫ヤコブ,村人,いるっぺぇけんども、おらはそうでもない。狼なんざ、いくらでも"えんぎ"できるべぇ。まぁこれは皆と自分への釘刺しだぁ。ヨアさんや、おっちょこちょいも気をつけるだよぉ。「ややぁっ!分かりづらい旅の占COだが、仲間である青年は知ってたから3COと言ったのかぁ？」とも思っちまったべ。でも占2CO出てる時点で、狼が3COする"めりっと"はなさそうだもんなぁ。おら早とちりしちまっただ。
1日目,農夫ヤコブ,村人,クララさんは、眼鏡っ子だけにしっかりしとるなぁ。今日は占い必要ない人一等だぁ。さぁて、増えた議事録もあるし、また読んでくっぺ。今日は情報もすくないしなぁ、狼に占いあてられれば一番なんだが、2-1だし、3潜伏だし、占[真狂]の可能性が高いだしで、確白を得るのもありなのか、それとも今日から班の方がこの先にいいのか、ちとわからねーでいるだ。
1日目,村長ヴァルター,狂人,クララさんに質問…>>243の発言の最後の行の言葉についてなんですがリーザさんが少し気になるとはどういった意味で気になるということなんですか？それと自分の考えを素直に表明してなにがいけないんですか？
1日目,司書クララ,村人,☆村長さま＞>>243は次に続いておりますよ。ディーターさまは灰考察の仕方など、こなれた感じでいらっしゃいますね。>>268の質問は鋭いと思いました。ここも今日占う必要はないでしょう。ペーターさまは初日苦手と言いつつも情報を拾う姿勢が感じられますね。発言伸び期待の意味も込めてここも外して良いかと。★確白狙いとありますが、確白は襲撃を受けやすいこと、狂人潜伏の可能性は考えておいででしょうか？
1日目,少年ペーター,村人,>>295 クララさん☆うん。確かにそうだね。お弁当ってやつだよね。もちろん知っているけど、だからといって襲撃受けるとは限らないしね。この懸念はもちろんあるけど灰でも白すぎてこの人死ぬかもって人は襲撃されるしからね・・・。自分本位って行動はあまり考えるほうじゃないけど見定めたいってのが勝るからってことだね～。あと潜伏狂人だけど占いあたってもその線が可能性あるかぎりはマークははずさないつもりだよ
1日目,羊飼いカタリナ,占い師,のど飴ころころ。>>268「今後の発言待ち」っていうのはそのままで、>>210時点では、>>205が>>201を占COと誤認したせいだと気付いていなかったから、どうして占3COになるのか説明が欲しいー、と思ったわけです。「ジム狼ならヨア狼もあり得る」は、私の白（占or狂）が見えているから、ヨア狼視点、占3COになっても、違和感なく受け入れられる下地がありそうって考えが起点になってます。
1日目,旅人ニコラス,人狼,箱がトラぶったが何とか復帰【修の霊確定を確認 決定時間了解】>>218了解、要するに村の総意とは言うものの最初から初日CO前提だったってこと？>>220選択肢というか霊を確定させるかを選択するのは人狼サイドかと。あと個人的に人狼側は2-2が本命、3-1が対抗だと思ってる。だから私は確霊は前提にしない。意味について,白黒を分けるためには相手の考え方が分からないと価値観が違う人物が黒く見える。
1日目,旅人ニコラス,人狼,最も霊確定した以上、今は意味が無いのは確かだ。以下灰について気になった点、白黒考察と言うよりは雑感長：言っちゃ悪いが更新時間から掛け離れた確認限度、根拠の見えない希望の発言など真剣味が見えない。このタイプは内容がどうであれ▼に挙げたい。者：傷書私の放置理由は分かる気がするが、青放置の理由が読み取れない。(予想は出来るが)。何か行が欠けてるみたいに見える。が他はシンプルかつ分かり易い。
1日目,旅人ニコラス,人狼,年：全体に軽め、かつ今一つ考え方の根っこが見えてこない。今のところはノイズ気味。妙：考察は軽めで、発言も流れに乗ってるようにも見える。●長は適当なSG押し付けにも思えるがSGなら▼にする方が狼側としては効率が良さそうにも思える。総じてやや黒目。青：やや飛んでる感があるが説明が丁寧かつ分かり易い。もし人狼ならかなりのベテランか初心者の二択。どっちにしてもしばらく見ておいて良さそう。
1日目,少年ペーター,村人,今日の希望です～。●リーザちゃん○パメラおねーちゃん理由はニコラスさんＣＯのあとのネタ？投下でＣＯ内容に触れなかった事かな・・・でも見落としもあるし、気にしてないってのもあるのかな？●村長さんもキニナルところ。寡黙を▼ならわかるんだけど●は僕のなかでは無難を選んだとか不自然とみちゃうかな。パメラおねーさんは話してくれてるんだけど印象にないんで当てたいかもって○です。
1日目,旅人ニコラス,人狼,娘：言い回しだけじゃなくて内容も固くて無駄が無い。今のところ根が少し見えにくいノイズ気味。このタイプは途中でどこかが崩れると白黒見え易いと思ってるので今のところは様子見かな。農：少々読み難い。田舎っぺステルス？推理方自体は分かり易いが今一つ考えが見えない。ノイズ。書：今のところ一番思考が分かり易く内容も納得が行く。少なくとも判定を急ぐ必要は感じない。
1日目,農夫ヤコブ,村人,娘さんのことは、者と青が娘に質問してる回答を得たら、また考えたいだ。理由もないし、確かに大雑把すぎるが、まぁ、思うことを落としてくれてる姿勢は村敵関係なく助かるべ。それに対して、小さい嬢ちゃんの方だなぁ。●長についてだが、理由はなぁ至極納得いくんだが…。その他の灰については触れてないし、突飛だ。★嬢ちゃんも、序盤は盤面整理派だべか？嬢ちゃんにとって、他灰の発言で訝しむ点は皆無だっぺか？
1日目,旅人ニコラス,人狼,あと書が手数の問題を上げているが、私は多少厳しい局面でも寡黙は吊るべきだと思っている。寡黙でいることが所属陣営を不利にする緊張感を強いることが出来るからだ。まあこの村だけで見ると意味は無いがね。今のところは●年○農かな、個人的には妙も捨て難いが占いは分かりにくい部分を、黒く見えるなら吊ってしまえが持論なのでこうなる。特に手数が厳しいと占で黒判定→吊りで2手掛けることすら手損になる。
1日目,旅人ニコラス,人狼,さて書いて張っての間に発言が流れてるな。読みながら合わせて能力者の考察を行おう。ついでに先に宣言しておこう。私はローラーが嫌いだ。手数的に詰みで無い限り賛同はしない。確霊がいるわけでパンダ発生→吊り→真襲撃のコンボがありそうだから杞憂かも知れないが一応。@5
1日目,少年ペーター,村人,リーザちゃん289>> リーザちゃんも3ＣＯだと勘違いしてたけどみながしたってことだよね。そうかーなら僕のリーザちゃん●理由がちょっとおかしくなってくるな～。★リーザちゃんは●って言ってるけど▼じゃないのは手数の問題からなの？ちょっと意見をきかせてほしいな～。
1日目,青年ヨアヒム,村人,ただいまあなのですよヽ(´∀｀)ノ＞誰かが言ってた僕の発言数……発言数はねー。今回何個か無駄発言しちゃってるからこれでもかなり節約気味ではあるのですけどねー。この国怖いよねー。まばたきしてる間に残発言数消えちゃうよねー(ノ∀｀)ﾌｼｷﾞｰ書>>273僕的にはたいして違和感のない所にしつこく食らいついてるなあ、というのが気になる部分で、でもそれでいちゃもんつけるでなく理解できる考え方で結論付
1日目,青年ヨアヒム,村人,けてるのでロックオン気味の村人なだけかもねーって思ったって感じですね。具体的には青>>236、>>237で言った部分についてニコさんの結論付けが自然に見えたのです。者>>278纏める気満々だったじゃないですか。修>>220、>>221とか2発言も費やして。これで対抗が絶対あることを知ってる偽だったら中々凝った演出だなーと思うですよ。
1日目,旅人ニコラス,人狼,なんか妙に行が少ないと思ったら傷の考察が消えてる件について傷：自分の考え方を丁寧に説明するのは真偽関係なく好感がもてる。考え方も概ね納得出来るが占候補と放置の差が分かり難い気がする。丁寧な説明と違和感がありやや黒目か。占い考察羊：やはり>>174は真狂狼どれでも勇み足。ただ仲間がおり、開始直後で動きを決めるのが難しい人狼ではあり得ないと思う。
1日目,旅人ニコラス,人狼,逆に最初から打って出る気の人狼なら初手でCOとかしそうだ。灰考察を投げており対抗をあまり意識してないのは真っぽい。(真>狂>>>狼)神：全体無難な発言からすると農に対する疑い返しが少々気にかかる。灰考察は羊より丁寧にも見えるがそれだけに●希望がちょっと違和感。(狂>真>>狼)@3喉のペースを完全に忘れてるorzしばらく黙る。
1日目,負傷兵シモン,人狼,今から個々の細かい考察書いてると仮決定の時間を過ぎそうだから、とりあえず伝書鳩を通じて流し読みした範囲で希望を出しておく。後で発言追って説明するが、ヤコブとディタも初日に占い当てるようなとこじゃないから外す。村長は逆に占い使うの勿体無いからここも除外。
1日目,負傷兵シモン,人狼,つーわけでとりあえず消去法みたいになっちまったが、特別黒いやつも見当たらねえし、人物像が見え辛い●ペタで希望出す。第二希望は悩ましいから少しだけまってくれ。
1日目,青年ヨアヒム,村人,今日の占先だけど僕的には、経過観察[旅兵書者] 占いたい[娘女農] ええと…[年長]というような感じ。ちょっと前4人は喉の都合で置いといて、年長は、んー。年はまだしも長占は……ちょーっと失礼だけど、仮に白でも確白突死が怖ごめんなさい。年は占でもいいかも。肝心の占いたいグループは、リザちゃんはぱっそん的に女>>229の発言が、狼による誘導の軽い恐れなのかなって風に見えて村印象です。ごく軽く。
1日目,シスターフリーデル,霊能者,占い票まとめ（問題点合ったらどうぞ）足りないですね・・・人羊神修者司青娘農女兵旅少村役占占霊××××××××××●×農×女××村××年年女書◯×☆×娘××××××農娘者
1日目,青年ヨアヒム,村人,パメちゃんは、青>>251の返答が気になるのだけどまだみたいだね。待てれば発言を待ちたい。ヤコさんは、農>>292が単純に「僕が分かりにくい非COをCOと勘違いした」と解釈するのでなく「旅青狼で旅の分かりにくいCOをちゃんとCOと理解していたように見えた(？)」っていう風に取るのは、瞬間的な発想としてはどうも不自然な気がするんだけど……これは対象が僕自身だからそう感じるのかなぁ？@2ｳﾋｮｰ
1日目,羊飼いカタリナ,占い師,それにしても……灰が広い。今、白でいいかも、って言えるのはヨアくらいかな。議事読みつつ、灰の切り分けを再開。えっと、ヨア、ニコ、そんちょを占いから外す、までやったよね。ヤコは、最初>>241、>>242が微白、くらいだったけれど、>>291、>>292でヨア白視に警鐘を鳴らしてるのは好印象。ヤコ狼、ヨア村なら、ヨア白いよ、って世論に乗っかっておけばよかったんじゃないかなって思い、占い外し。
1日目,農夫ヤコブ,村人,まぁ、おらもこれといった黒い感じも見つけてねぇだ。占希望は今考えてるところでは、消極的だが消去法だべ…。ディータは「おらも聞きたいだぁ」と思うところを質問してくれてるだ。これは眼鏡っ子も同じだべ。情報を落としてくれてるし、発言もあるから占先候補からはずれるっぺ。娘さんは発言(回答)待ち。シモさんは思考開示の姿勢が見えるからなぁ。青年も性格わかるし、参考にしてもらってるところあるんだ。
1日目,シスターフリーデル,霊能者,占い票まとめ（修正('A`)ｳﾞｧｰ）人羊神修者司青娘農女兵旅少村役占占霊灰灰灰灰灰灰灰灰灰灰●×農×女××××村年年女書（村長は順不同）◯×☆×娘××××××農娘者
1日目,羊飼いカタリナ,占い師,クラは、色は濃くないものの、思考が模範的で理解し易い。乱れがあればわかりそなので、占い外し。ペタは、そんちょよりは安定しているものの、そんちょと同じく単独の気配があり、占い外し。ディタは、>>277、>>278、>>279で、初日から放置枠が多く、狼ならSG探しが大変そう……、占い外し。追記：何で>>241、>>242が微白なのかは、明日あたり説明するので、今は聞かないでおいてほしいな。
1日目,農夫ヤコブ,村人,旅人さんは、占COまわりのつっこみが的確だべ。んだが、初日からきっちり灰考察落とせるのがたまげたというかなんというだか…。少し気になるだが、発言から見れる人だしなぁ。後は[妙年長]だべか。神占CO後に非占した中[妙兵旅年長]に一狼はいそうだし、占っていいところな気もするべ。ちとペタ坊を読み返してくるべ。あ、おらの話し方、わからないところ多いべか？それだったら直すべ。
